artist,datetime,content
Lucio Corsi,2025-02-14 22:40:36,"ancora ferma ai due topini aka Lucio Corsi e Topo Gigio boh sciogliendomi 
#Sanremo2025"
Lucio Corsi,2025-02-14 22:32:29,"io una bimba di Lucio Corsi e topo Gigio per sempre

#sanremo2025"
Lucio Corsi,2025-02-14 22:43:37,"ecco inedite alcune foto della casa di Lucio Corsi
#Sanremo2025"
Lucio Corsi,2025-02-14 22:44:55,cmq post seduta dalla psico vedere le esibizioni di lucio corsi e riascoltare la sua canzone mi sta facendo un bell'effetto perché mi fa riflettere su quanto non devo per forza nascondere lati di me come la spontaneità o la dolcezza o la vulnerabilità e che va bene essere diversi
Lucio Corsi,2025-02-14 22:21:47,"La più grande scoperta di questo festival, per noi del pubblico generalista, è stato Lucio Corsi (o conferma per chi già era suo fan)"
Lucio Corsi,2025-02-14 22:33:14,"Sconcertante che Tony Effe e Lucio Corsi facciano lo stesso mestiere. 

#LucioCorsi #Sanremo2025"
Lucio Corsi,2025-02-14 22:09:04,"Lucio Corsi e Topo Gigio 

Peccato la mancanza di rispetto di Conti e poi di Mahmood che hanno totalmente ignorato Lucio Corsi, lasciandolo lì solo.
Una grande tristezza, dopo un momento magico.
Non è da tutti saper volare nel blu dipinto di blu!"
Lucio Corsi,2025-02-14 22:23:08,"Despues de ver lo de Lucio Corsi y Topo Gigio, Simone Cristicchi podria haber hecho una cover preciosa con Lublu el de los Lunnis

#Sanremo2025"
Lucio Corsi,2025-02-14 22:35:30,"topo gigio e lucio corsi vi voglio benissimo 
#Sanremo2025"
Lucio Corsi,2025-02-14 22:45:48,"Io se qualcuno dovesse dire una parola contro Lucio Corsi davanti a me
#Sanremo2025"
Lucio Corsi,2025-02-14 22:32:04,"carloco che ringrazia e saluta topo gigio e NON DICE UNA SINGOLA PAROLA A LUCIO CORSI IO BOH TRATTA I CONCORRENTI COME SE FOSSERO I MENO IMPORTANTI DI TUTTO IL FESTIVAL 

#Sanremo2025"
Lucio Corsi,2025-02-14 22:19:41,31 años tiene solo lucio corsi
Lucio Corsi,2025-02-14 22:02:12,appena votato il cucciolo lucio corsi perché ci ha regalato il momento più dolce e più tenero della storia del festival
Lucio Corsi,2025-02-14 22:52:24,"Lucio Corsi ha rischiato grosso ma ha vinto alla grande, contro ogni pregiudizio, con infinita dolcezza. Il suo duetto con Topo Gigio è da fuoriclasse
#Sanremo #Sanremo20205 
#sanremo25 
#Sanremo2025"
Lucio Corsi,2025-02-14 22:26:18,lucio corsi è stato davvero la scoperta di questo festival #Sanremo2025
Lucio Corsi,2025-02-14 22:00:19,"Carlo Conti imperatore, Benigni, Lucio Corsi che duetta con Topo Gigio. È la notte del monopolio granducale. Cose che potete fare per opporvi? Nessuna. #Sanremo2025"
Lucio Corsi,2025-02-14 22:18:11,Quell'incredibile somiglianza tra lucio corsi e harlequinstat
Lucio Corsi,2025-02-14 22:21:19,"Quando Lucio Corsi ha detto a Topo Gigio ""anche i topi possono volare"" l'ho sentito TUTTO"
Lucio Corsi,2025-02-14 22:45:40,"Lucio Corsi è l’elemento di rottura di questo Festival di Sanremo, e lo  conferma la scelta di esibirsi accanto a Topo Gigio nella serata cover.  Un azzardo folle, ma vincente, che ha funzionato non solo sul piano  comunicativo..."
Lucio Corsi,2025-02-14 22:19:31,"Lucio Corsi ha fatto il vuoto #Sanremo20205 
@SanremoRai
 @luciocorsi"
Lucio Corsi,2025-02-14 22:27:24,Lucio Corsi sta al gioco ma non sta al gioco. #TikTok #SANREMO2025 https://vm.tiktok.com/ZNd1hGRpn/
Lucio Corsi,2025-02-14 22:32:21,"SANREMO | Topo Gigio all'Ariston: ""Per fortuna a Sanremo mi ci ha portato Lucio Corsi"" #Sanremo2025 #ANSA"
Lucio Corsi,2025-02-14 22:50:40,la cover de rocco hunt la mejor de la noche después de topo gigio y lucio corsi y a la par que los tortolitos
Lucio Corsi,2025-02-14 22:42:18,"Fate entrare Lucio Corsi che ci droppa la sua armonica insieme ai violinisti gemelli
#Sanremo2025"
Lucio Corsi,2025-02-14 22:56:02,per adesso gli unici a meritare la top 5 sono serena branc con ale amo e lucio corsi e topo gigio .
Lucio Corsi,2025-02-14 22:03:20,"ma lucio corsi sa cantare, suonare la chitarra, il piano, l'armonica, QUANTE COSE SA FARE BASTA"
Lucio Corsi,2025-02-14 22:20:05,"Lucio Corsi si, è interessante per tutto il resto ci vorrebbe Califano"
Lucio Corsi,2025-02-14 22:32:06,lucio corsi col topo il volo ha cantato con LA TOPA
Lucio Corsi,2025-02-14 22:43:58,"Non si può morire dentro! .  Gianni Bella era un Lucio Corsi di mezzo secolo fa! Non possiamo non piangere guardandolo ora malato come è, abbracciare la sorella, Gianni e Marcella Bella! #Sanremo2025"
Lucio Corsi,2025-02-14 22:24:48,"lui lo aveva detto che non sarebbe stata una gag per portare il trash (quello è stato portato da altri due secondi dopo)
topo gigio può essere considerato come simbolo della creatività, della fantasia e dell'infanzia; e la musica di lucio corsi lo rispecchia"
Lucio Corsi,2025-02-14 22:39:07,Lucio Corsi detto l'uomo che sussurrava ai topi
Lucio Corsi,2025-02-14 22:22:57,"Io ancora ferma a Topo Gigio, mi stavo per commuovere 
Un'idea bella, dolce e significativa
Che bello aver scoperto un'anima come Lucio Corsi
#sanremo2025"
Lucio Corsi,2025-02-14 22:27:00,"""Penso che un sogno così non ritorni mai più
Mi dipingevo le mani e la faccia di blu
Poi d'improvviso venivo dal vento rapito
E incominciavo a volare nel cielo infinito"".
Cantano Lucio Corsi e Topo Gigio in un mix di estro, dolcezza, follia e poesia #sanremo25 #LucioCorsi"
Lucio Corsi,2025-02-14 22:25:39,tutto bellissimo quello che ha fatto Lucio Corsi ma ricordiamo anche che Topo Gigio si era già esibito con Valerio Lundini #Sanremo2025 
Lucio Corsi,2025-02-14 22:46:23,"Alla fine dell'esibizione questo ragazzo si mette in disparte, educato, leggero e in silenzio, mentre Conti e Mahmood circondano Topo Gigio, acclamandolo come la vera super star della serata.

Ed era esattamente quello che voleva Lucio Corsi 

#Sanremo2025"
Lucio Corsi,2025-02-14 22:43:26,"se chiamo menestrello lucio corsi è affectionate, se chiamo menestrelli i twin violins è derogatory"
Lucio Corsi,2025-02-14 22:19:10,"Una delle esibizioni più belle del Festival. Topo Gigio è irriverente, comico, emozionante, fuori dagli schemi, come Lucio Corsi. Questo duetto è stato perfetto. #Sanremo2025"
Lucio Corsi,2025-02-14 22:51:01,"Probabilmente il vaiolo delle scimmie è nato da un’interazione sbagliata tra uomo e roditore, stasera Lucio Corsi ha provato a bilanciare la cosa proponendoci un’esibizione davvero unica. 

#Sanremo2025"
Lucio Corsi,2025-02-14 22:30:04,L’artista che sei Lucio corsi #sanremo2025
Lucio Corsi,2025-02-14 22:23:08,Io voglio un mini lucio corsi da mettere in tasca e portarmelo appresso dovunque #Sanremo2025
Lucio Corsi,2025-02-14 22:20:35,No ragazz* sono passati minuti ma io sono ancora ferma al duetto di Lucio Corsi e Topo Gigio non mi sembra affrettato dire che è già la mia cosa preferita dell'anno #sanremo2025
Lucio Corsi,2025-02-14 22:09:39,"Fino adesso Lucio Corsi e Topo Gigio MVP della serata cover. 

#Sanremo2025"
Lucio Corsi,2025-02-14 22:55:35,Per me Lucio Corsi una delle più grandi rivelazioni del Festival
Lucio Corsi,2025-02-14 22:49:38,purtroppo già letto tantissime rosicate su lucio corsi e si ci godo che vi sta facendo mangiare le mani la sua cover con topo gigio
Lucio Corsi,2025-02-14 22:52:51,"lucio corsi sei la persona più divertente di questo 75 festival della canzone italiana 
#Sanremo2025"
Lucio Corsi,2025-02-14 22:49:36,come guardo lucio corsi ogni volta che appare in tv #Sanremo2025
Lucio Corsi,2025-02-14 22:50:16,"NON TONY EFFE CON LA MAGLIA CHE CITA ""NON COGLIO ESSERE UN DURO"" OVVERO LUCIO CORSI E LA FACCIA DI TOPO GIGIO È TUTTO MERAVIGLIOSO 

#Sanremo2025"
Lucio Corsi,2025-02-14 22:32:45,può carlo conti o il papa crepare così questo sacrificio ci serva per portare i the kolors e lucio corsi in top3 stasera
Lucio Corsi,2025-02-14 22:19:20,Fortissimamente Lucio Corsi e il suo genio romantico e sognante. Un artista che serviva a questo paese #SANREMO2025
Lucio Corsi,2025-02-14 22:06:02,"Topo Gigio ha segnato l'infanzia. È la dolcezza, l'allegria.
Rivederlo che emozione.
Ci voleva Lucio Corsi a risvegliare quel lato puro e gentile 

#sanremo25 #FestivaldiSanremo2025 #LucioCorsi"
Lucio Corsi,2025-02-14 22:55:09,Scopro colpevolmente solo ora la fonte dell'omaggio di Lucio Corsi #Sanremo2025
Lucio Corsi,2025-02-14 22:30:38,LUCIO CORSI E TONY EFFE STO MORENDO #sanremo2025
Lucio Corsi,2025-02-14 22:04:15,"Lucio Corsi ha realizzato una delle performance più iconiche nella storia di Sanremo.

Lo vedremo a Techetechete per tantissimo tempo.

#Sanremo2025"
Lucio Corsi,2025-02-14 22:35:47,"Lucio Corsi, chi è l'alieno che si è preso Caterina Caselli e poi questo Sanremo"
Lucio Corsi,2025-02-14 22:20:30,"Sto recuperando #sanremo25 su RaiPlay. Pur mancandomene ancora un po', un'idea degli artisti che mi piacciono di più me la sono fatta: Lucio Corsi, Brunori, Willie Peyote, Joan Thiele, Giorgia, Shablo. Bon. Segue. 1/2"
Lucio Corsi,2025-02-14 22:03:24,"Questo mazzolino di fiori dopo aver fatto uno spettacolo volando, cantando con Lucio Corsi (una delle rivelazioni di questo festival), resterà nella storia 

#Sanremo2025"
Lucio Corsi,2025-02-14 22:31:08,"“ti ricordi quella volta in cui lucio corsi duettò con topo gigio, gli portarono un mini mazzo di fiori e mahmood si fece il selfie con lui”

LORO HANNO APPENA SCRITTO UNA PAGINA DI STORIA DEL FESTIVAL 
#Sanremo2025"
Lucio Corsi,2025-02-14 22:12:21,"Mi dispiace per tutti quelli che si esibiranno dopo lucio corsi e topo gigio perché purtroppo io sono troppo allucinata per riuscire a concentrarmi 
#Sanremo2025"
Lucio Corsi,2025-02-14 22:23:28,Lucio Corsi l’ho apprezzato tantissimo con Topo Gigio ma anche in Profondo Rosso.
Lucio Corsi,2025-02-14 22:01:25,"Anche Lucio Corsi avrebbe voluto fare il selfie 
#Sanremo2025"
Lucio Corsi,2025-02-14 22:49:18,"Lucio Corsi. A Star is born.
Un Artista"
Lucio Corsi,2025-02-14 22:49:15,"io quando Lucio Corsi
#Sanremo2025"
Lucio Corsi,2025-02-14 22:08:35,"Lo aveva detto. “Non è uno scherzo” “Faccio sul serio”.
 
E così è stato.

Quello di Lucio Corsi, assieme a Topo Gigio (sì, lui), è stato un momento di grande musica, di arte e cultura alta e insieme popolare, di sensibilità, garbo, e profonda cultura musicale, un omaggio"
Lucio Corsi,2025-02-14 22:21:25,secondo me lucio corsi è nato dalla prima risata di un bambino ed è stato portato dal vento nella Radura Incantata tipo Trilli di Peter Pan e poi lì si è scoperto che il suo talento è la musica anche se secondo me da vibes da tuttofare
Lucio Corsi,2025-02-14 22:38:48,lucio corsi non poteva non dare la maglia con un ratto ad un altro ratto che genio
Lucio Corsi,2025-02-14 22:37:16,ma lucio corsi che potere ha su questi topi sei magico
Lucio Corsi,2025-02-14 22:35:30,"topo gigio e lucio corsi vi voglio benissimo 
#Sanremo2025"
Lucio Corsi,2025-02-14 22:19:20,Fortissimamente Lucio Corsi e il suo genio romantico e sognante. Un artista che serviva a questo paese #SANREMO2025
Lucio Corsi,2025-02-14 22:06:02,"Topo Gigio ha segnato l'infanzia. È la dolcezza, l'allegria.
Rivederlo che emozione.
Ci voleva Lucio Corsi a risvegliare quel lato puro e gentile 

#sanremo25 #FestivaldiSanremo2025 #LucioCorsi"
Lucio Corsi,2025-02-14 22:49:18,"Lucio Corsi. A Star is born.
Un Artista"
Lucio Corsi,2025-02-14 22:49:15,"io quando Lucio Corsi
#Sanremo2025"