artist,datetime,content
Willie Peyote,2025-02-12 23:24:57,"Sono ancora le 23:25 e mancano soltanto 5 artisti. 
Achille Lauro, Giorgia, Rkomi, Rose Villain e Willie Peyote.

Festival lineare e veloce, sopportabile da un'over 50 che si alza prestissimo... Apprezzo!
#Sanremo25 #Sanremo2025"
Willie Peyote,2025-02-12 23:08:32,"Sanremo, dopo l'esibizione le coriste di Willie Peyote rifiutano la rosa: ""Grazie ma no Grazie"""
Willie Peyote,2025-02-12 23:20:01,"Festival di #Sanremo2025 , la #Liguria in un mare di meme. Gerry Scotti graffia, Willie Peyote morde, Rose Villain avvolge #sanremo25 #Sanremo"
Willie Peyote,2025-02-12 23:32:10,"ammetto di star aspettando con ansia l'esibizione di willie peyote solo per vedere se quest'icona di luca ravenna riuscirà a dire ciò che deve dire
#Sanremo2025"
Willie Peyote,2025-02-12 23:47:43,"per me willie peyote e willy il coyote diventano automaticamente la stessa cosa non appena lo annunciano e VA BENE COSÌ 

#Sanremo2025"
Willie Peyote,2025-02-12 23:30:51,"qualcuno chiami lui, diodato, brunori sas e willie peyote sul palco immediatamente"
Willie Peyote,2025-02-12 23:29:17,joder este track run que venimos de bresh y ahora van giorgia rkomi rose villain willie peyote
