artist,datetime,content
Simone Cristicchi,2025-02-14 22:09:52,"Simone Cristicchi 

""Abbi cura di me"" 

Il tempo ti cambia fuori
l'amore ti cambia dentro
Basta mettersi al fianco
invece di stare al centro
L'amore è l'unica strada
è l'unico motore
È la scintilla divina
che custodisci nel cuore"
Simone Cristicchi,2025-02-14 22:54:33,"Se Marcella Bella avesse cantato una canzone su Gianni Bella avrebbe stracciato Simone Cristicchi.
#sanremo25 #MarcellaBella #SimoneCristicchi"
Simone Cristicchi,2025-02-14 22:03:45,Equa Tu deutsche Simone Cristicchi #ChefsacheESC
Simone Cristicchi,2025-02-14 22:23:08,"Despues de ver lo de Lucio Corsi y Topo Gigio, Simone Cristicchi podria haber hecho una cover preciosa con Lublu el de los Lunnis

#Sanremo2025"
